{
  "$schema": "https://json-schema.org/draft/2020-12/schema",
  "$id": "https://github.com/Dorusto/yt-pipeline/schemas/shot_plan.schema.json",
  "title": "shot_plan",
  "description": "The screenwriter's plan for one edit, written by scripts/llm_director.py before the editor picks exact timecodes: the story structure in beats and a slot plan naming which shot goes where, how long it should be and why. The editor turns this into edit.json; the reviewer checks the result against this plan and the brief.",
  "type": "object",
  "required": ["schema_version", "generated_at", "brief", "content_type", "structure", "slot_plan"],
  "additionalProperties": false,
  "$defs": {
    "shot_ref": {
      "type": "string",
      "minLength": 3,
      "description": "shot key from shotlog.json: <clip counter>/<segment id>, e.g. 0081/s7"
    }
  },
  "properties": {
    "schema_version": {"type": "string", "minLength": 1},
    "generated_at": {
      "type": "string",
      "description": "ISO 8601 timestamp of the plan"
    },
    "tool": {"type": "string"},
    "brief": {
      "type": "object",
      "required": ["text"],
      "additionalProperties": false,
      "properties": {
        "text": {"type": "string"},
        "target_duration_s": {"type": ["number", "null"], "exclusiveMinimum": 0},
        "order": {"type": ["string", "null"], "enum": ["chronological", "score", null]},
        "pacing": {"type": ["string", "null"], "enum": ["calm-to-energy", "uniform", null]},
        "ambient_only": {"type": ["boolean", "null"]}
      }
    },
    "content_type": {
      "type": "string",
      "enum": ["vacation", "tutorial", "presentation", "talking-head"]
    },
    "logline": {
      "type": "string",
      "minLength": 1,
      "description": "one sentence: what this edit is about and how it feels"
    },
    "structure": {
      "type": "array",
      "minItems": 1,
      "description": "the story beats in order; the sum of target_s should be the brief's target duration",
      "items": {
        "type": "object",
        "required": ["id", "name", "intent", "target_s"],
        "additionalProperties": false,
        "properties": {
          "id": {"type": "string", "minLength": 1},
          "name": {"type": "string", "minLength": 1},
          "intent": {
            "type": "string",
            "minLength": 1,
            "description": "what this beat does for the story, e.g. 'open on the water, calm'"
          },
          "target_s": {"type": "number", "exclusiveMinimum": 0}
        }
      }
    },
    "slot_plan": {
      "type": "array",
      "minItems": 1,
      "description": "what each video slot should be, in timeline order; the editor picks the exact timecodes inside the shot's window",
      "items": {
        "type": "object",
        "required": ["id", "beat", "shot_key", "target_s", "why"],
        "additionalProperties": false,
        "properties": {
          "id": {
            "type": "string",
            "minLength": 1,
            "description": "slot id, v1, v2, ... matching the edit it will become"
          },
          "beat": {
            "type": "string",
            "minLength": 1,
            "description": "the structure[].id this slot serves"
          },
          "shot_key": {"$ref": "#/$defs/shot_ref"},
          "target_s": {
            "type": "number",
            "exclusiveMinimum": 0,
            "description": "how long the slot should be; the editor clamps it to the shot's window and the hero/semantic cap"
          },
          "why": {
            "type": "string",
            "minLength": 1,
            "description": "why this shot serves the beat"
          },
          "keep_whole": {
            "type": "boolean",
            "description": "true when the shot is a hero or a complete semantic move and must keep its whole window up to the cap"
          },
          "deliberate": {
            "type": "boolean",
            "description": "true when the cut into this slot is deliberate (the owner asked for both shots, or the story needs it); the reviewer allows a same-segment-beat or similar neighbour pair only then"
          }
        }
      }
    },
    "notes": {
      "type": "array",
      "items": {"type": "string"},
      "description": "anything the editor and reviewer should know"
    },
    "meta": {
      "type": "object",
      "required": ["tool", "wall_time_s", "llm_cost_usd"],
      "additionalProperties": false,
      "properties": {
        "tool": {"type": "string"},
        "wall_time_s": {"type": "number", "minimum": 0},
        "llm_cost_usd": {"type": "number", "minimum": 0}
      }
    }
  }
}
